id,recipe_id,step_number,instruction
947,178,4,"Reduce remaining marinade until thick. Brush over yakitori."
948,178,5,"Serve hot."
949,179,1,"Cook lasagna noodles. Prepare vegetable filling by sautéing mixed vegetables."
950,179,2,"Mix ricotta with egg, parmesan, and herbs. Prepare tomato sauce."
951,179,3,"Layer in baking dish: sauce, noodles, ricotta, vegetables, mozzarella. Repeat."
952,179,4,"Top with mozzarella and parmesan."
953,179,5,"Bake at 375°F for 45 minutes. Let rest 15 minutes."
954,180,1,"Marinate chicken in lemon juice, oregano, and garlic for 2 hours."
955,180,2,"Grill chicken for 12-15 minutes. Slice."
956,180,3,"Cook rice. Prepare tzatziki sauce."
957,180,4,"Assemble bowls: rice, chicken, cucumber, tomatoes, and tzatziki."
958,181,1,"Cook ramen noodles. Heat broth with ginger and soy sauce."
959,181,2,"Slice beef and sear quickly. Prepare soft-boiled eggs."
960,181,3,"Assemble bowls: noodles, broth, beef, eggs, and green onions."
961,182,1,"Cook rice. Season chicken and cook in a skillet."
962,182,2,"Heat black beans with cumin. Warm corn."
963,182,3,"Assemble bowls: rice, chicken, beans, corn, and salsa."
964,183,1,"Marinate beef cubes in olive oil, cumin, and paprika for 2 hours."
965,183,2,"Thread beef and vegetables onto skewers."
966,183,3,"Grill for 10-12 minutes, turning frequently."
967,183,4,"Serve with pita and tahini sauce."
968,184,1,"Heat oil. Add curry powder and cook for 1 minute."
969,184,2,"Add shrimp and cook for 3 minutes."
970,184,3,"Pour in coconut milk and tomatoes. Simmer for 20 minutes."
971,184,4,"Serve over rice."
972,185,1,"Cook chicken. Warm tortillas. Heat refried beans."
973,185,2,"Fill tortillas with chicken, beans, rice, and salsa."
974,185,3,"Roll up tightly and serve."
975,186,1,"Cook rice. Season chicken and cook in a skillet."
976,186,2,"Add broccoli and teriyaki sauce. Cook for 5 minutes."
977,186,3,"Serve over rice with sesame seeds."
978,187,1,"Heat oil. Brown beef strips. Remove."
979,187,2,"Sauté mushrooms and onions."
980,187,3,"Return beef. Add sour cream and simmer for 15 minutes."
981,187,4,"Cook egg noodles. Serve stroganoff over noodles."
982,188,1,"Marinate chicken legs in yogurt, tandoori masala, and lemon juice for 4 hours."
983,188,2,"Grill or bake at 400°F for 25-30 minutes until charred."
984,188,3,"Serve with naan, raita, and lemon wedges."
985,189,1,"Brown beef chunks in a pot. Remove."
986,189,2,"Sauté onions, carrots, and celery. Add tomato paste."
987,189,3,"Return beef with broth and potatoes. Simmer for 2 hours."
988,189,4,"Serve hot with crusty bread."
989,190,1,"Cook fettuccine. Heat cream in a pan until simmering."
990,190,2,"Add shrimp and garlic. Cook for 4 minutes."
991,190,3,"Add parmesan and toss with pasta."
992,190,4,"Serve immediately."
993,191,1,"Simmer chicken broth with star anise and ginger for 1.5 hours."
994,191,2,"Add chicken breast and cook for 15 minutes. Shred."
995,191,3,"Cook noodles. Assemble bowls with noodles, broth, and chicken."
996,191,4,"Garnish with herbs and bean sprouts."
997,192,1,"Brown ground beef. Add enchilada sauce and simmer."
998,192,2,"Fill tortillas with beef, roll up, and place in baking dish."
999,192,3,"Top with sauce and cheese. Bake at 350°F for 25 minutes."
1000,192,4,"Garnish with cilantro."
1001,193,1,"Cook udon noodles. Heat chicken broth with soy sauce."
1002,193,2,"Add chicken and cook for 10 minutes."
1003,193,3,"Serve in bowls with green onions."
1004,194,1,"Brown ground beef with taco seasoning."
1005,194,2,"Warm corn tortillas. Make pico de gallo with tomatoes, onions, and cilantro."
1006,194,3,"Fill tacos with beef and pico de gallo."
1007,195,1,"Cook egg noodles. Heat oil in a wok."
1008,195,2,"Add chicken and vegetables. Stir-fry for 6 minutes."
1009,195,3,"Add noodles, soy sauce, and oyster sauce. Toss well."
1010,196,1,"Brown lamb in a pot. Add curry powder and tomatoes."
1011,196,2,"Add coconut milk and simmer for 50 minutes."
1012,196,3,"Serve over rice."
1013,197,1,"Cook chicken. Slice. Warm tortillas."
1014,197,2,"Fill with chicken, lettuce, parmesan, and Caesar dressing."
1015,197,3,"Roll up and serve."
1016,198,1,"Heat oil. Cook beef for 3 minutes."
1017,198,2,"Add broccoli and teriyaki sauce. Cook for 5 minutes."
1018,198,3,"Serve over rice with sesame seeds."
1019,199,1,"Cook rice. Season chicken with fajita seasoning."
1020,199,2,"Sauté chicken, bell peppers, and onions."
1021,199,3,"Assemble bowls with rice, chicken, and vegetables."
